,Year,Content,One line,Five lines
55,1991,"Romania: Two steps to success
In 1988, Fran P., an American A.A. teaching English at Romania's University of Timisoara, attempts to start a group with the help of Rodica, an alcoholic student — but the program's reliance on a Higher Power runs afoul of government authorities. Only in 1991, almost two years after the Communist government has fallen, will an A.A. group flourish in Timisoara. In 1993, Petrica and Damian, alcoholics hospitalized in Bucharest, will start a group in the capital city with the help of Dr. Doina Constantinescu and Patricia and Lee, an A.A. couple from the U.S. This flyer is typical of A.A. Romania's efforts to reach out to struggling alcoholics.

Movement in Southeast Asia
In 1991, around five A.A.s begin to meet in Ubud, Indonesia, auguring the start-ups of small groups in Kuta, Sanur, and Seminyak. The meetings are attended by tourists passing through, but by 2003 some 40 Indonesians will have joined A.A. The early 1990s find stable groups of native speakers meeting in Thailand, Vietnam, Singapore, and Malaysia.

Canadians cross language barriers
In an effort to carry the message to the Native North American population in the Northwest Territory, who speak seven different languages, A.A.s in the Yellowknife area go about gathering all known Native American translations of A.A. literature. They confirm the translations' accuracy and build files that are easily accessible to A.A. members. Their efforts will continue, paving the way for an Eastern Canada regional trustee and a fellow A.A. to travel to remote communities in northern Quebec in May 2004, distributing A.A. literature in the Inuktitut language to educators, prison officials, attorneys, and mayors.

Missives to the Persian Gulf
After military action begins in the Persian Gulf in 1991, the G.S.O. New York staff member on the Loners/International Desk hears from scores of A.A.s serving in Saudi Arabia. Each is sent a copy of the new book Daily Reflections, a free subscription to the Grapevine, and any A.A. literature that is requested. One letter, from Sgt. John L., is representative. In it, he writes, “A lot of good has come out of my being in this desert. I've finally been forced to really take a good look at my life. As the Big Book says, I'm 'building an arch to walk through a free man [sic].'”

First Native American Convention in 1991
“Living Our Traditions Through Sobriety” is both the purpose of Native American A.A. gatherings and the motto on the emblem they create (right) for the first annual convention for Native American A.A.s from the U.S. and Canada. Among the 800 attendees at the event, held in October 1991 in Las Vegas, are Native Americans from some 100 tribes plus representatives of tribal alcohol programs, halfway houses, and treatment centers. In ensuing years, Washington, South Dakota, North Carolina, and other states will hold their own conventions, leading to the fourteenth National/ International Native American Convention which will convene in Minneapolis in 2004.

European Service Meetings
Meeting in Frankfurt (right), 32 A.A. delegates from 18 countries attend the 1991 European Service Meeting (ESM), the zonal conference that has been held biannually in the German city since 1981. The ESM gives delegates from European groups the opportunity to present progress reports and share their respective countries' problems in the hope of finding solutions.","['Canadians cross language barriers\nIn an effort to carry the message to the Native North American population in the Northwest Territory, who speak seven different languages, A.A.s in the Yellowknife area go about gathering all known Native American translations of A.A. literature.']","[""Romania: Two steps to success\nIn 1988, Fran P., an American A.A. teaching English at Romania's University of Timisoara, attempts to start a group with the help of Rodica, an alcoholic student — but the program's reliance on a Higher Power runs afoul of government authorities."", 'Only in 1991, almost two years after the Communist government has fallen, will an A.A. group flourish in Timisoara.', 'In 1993, Petrica and Damian, alcoholics hospitalized in Bucharest, will start a group in the capital city with the help of Dr. Doina Constantinescu and Patricia and Lee, an A.A. couple from the U.S.', 'Canadians cross language barriers\nIn an effort to carry the message to the Native North American population in the Northwest Territory, who speak seven different languages, A.A.s in the Yellowknife area go about gathering all known Native American translations of A.A. literature.', 'First Native American Convention in 1991\n“Living Our Traditions Through Sobriety” is both the purpose of Native American A.A. gatherings and the motto on the emblem they create (right) for the first annual convention for Native American A.A.s from the U.S. and Canada.']"
56,1992,"A.A. General Service Office moves uptown in 1992
After 20 years on Park Avenue South, on Manhattan's East Side, G.S.O. New York relocates to 475 Riverside Drive. The date is March 1992. (Serendipitously, the 19-story limestone building was built by the Rockefeller family, so important to the Fellowship's early history.) The G.S.O. occupies the entire 11th floor, with The Grapevine offices one flight up. Every year, hundreds of A.A. members from around the world visit. A tour of the offices and Archives is provided to all visitors; no appointment is necessary.","[""A.A. General Service Office moves uptown in 1992\nAfter 20 years on Park Avenue South, on Manhattan's East Side, G.S.O. New York relocates to 475 Riverside Drive.""]","[""A.A. General Service Office moves uptown in 1992\nAfter 20 years on Park Avenue South, on Manhattan's East Side, G.S.O. New York relocates to 475 Riverside Drive."", 'The G.S.O. occupies the entire 11th floor, with The Grapevine offices one flight up.', 'Every year, hundreds of A.A. members from around the world visit.', 'A tour of the offices and Archives is provided to all visitors; no appointment is necessary.']"
57,1993,"Mexico-Cuba sponsorship
In a textbook example of country-to-country sponsorship, Mexico succeeds in getting Cuba's first group going in February 1993: Grupo Sueño (Dream Group), in Havana. The year before, Cubans Ciro V. and Juan A. had asked government officials for permission to provide information about A.A. — in their words, “a program without nationalities, a political agenda, or financial interests” — but without success. Once A.A Mexico informs the Cuban government of the particulars of A.A.'s program of recovery, the government changes its mind and welcomes the Fellowship. By the end of 2004, some 200 groups will have become active in Cuba. The arrival of A.A. in the country is celebrated every January, as shown in the poster to the right.","[""Once A.A Mexico informs the Cuban government of the particulars of A.A.'s program of recovery, the government changes its mind and welcomes the Fellowship.""]","[""Mexico-Cuba sponsorship\nIn a textbook example of country-to-country sponsorship, Mexico succeeds in getting Cuba's first group going in February 1993: Grupo Sueño (Dream Group), in Havana."", 'The year before, Cubans Ciro V. and Juan A. had asked government officials for permission to provide information about A.A. — in their words, “a program without nationalities, a political agenda, or financial interests” — but without success.', ""Once A.A Mexico informs the Cuban government of the particulars of A.A.'s program of recovery, the government changes its mind and welcomes the Fellowship."", 'By the end of 2004, some 200 groups will have become active in Cuba.', 'The arrival of A.A. in the country is celebrated every January, as shown in the poster to the right.']"
58,1995,"Planting a seed in China
In 1995, retired Chinese physician Dr. Lawrence Luan, who owns a primary health care clinic in Santa Barbara, California, asks the clinic's administrator, who happens to be an A.A. member, to accompany him on a medical business trip to his hometown of Daiwan. To be granted a visa, the administrator must speak on a health topic, and while Chinese authorities request that he address HIV/AIDS, Dr. Luan arranges for him to speak to five doctors at the mental hospital in Daiwan on his subject of choice: alcoholism. The speech is well received, as are Chinese-language copies of the Big Book he presents to the doctors. In 1998, he will share his experience at the Pacific Regional Forum in Sacramento as a member of the International Panel. As a result, a member of the San Francisco Intergroup begins organizing a “messengers” group that will travel to China. Shown to the right is “Alcoholics Anonymous” in Chinese script.

Canada's golden anniversary
During the first weekend of July 1995, more than 6,000 A.A.s and friends from Canada, the U.S., South America, Europe, and Asia gather in Toronto at the Metro Convention Center to celebrate 50 years of Alcoholics Anonymous in Canada. The program includes 34 speaker meetings, 26 panels, 40 marathon meetings, and two talkathons.

Celebrating 60 years
The theme of the 60th Anniversary International Convention — “A.A. Everywhere–Anywhere” — is borne out as nearly 56,000 people from the U.S., Canada, and 85 other countries gather in San Diego, California, in June-July 1995. Among the highlights are an opening-night waterfront dance with fireworks exploding across the bay, an opening meeting that sees Jack Murphy Stadium filled to capacity, and oldtimers recounting stories at the “Forty Years or More Sober” meeting, Saturday night's featured event. Shown at right is the Convention's souvenir book.

First Asia/Oceania Service Meeting
Years after Bob P. of New Zealand conceives the idea of a zonal meeting serving Asian and Pacific Island A.A. groups, the first Asia/Oceania Service Meeting (AOSM) is held in Tokyo in March 1995. Bob P. chairs the meeting, and its “Twelfth-Stepping Your Neighbor Country” theme emphasizes the shared responsibility of carrying the message in this part of the world. Attending are delegates from Australia, Hong Kong, Japan, Korea, New Zealand, and Vanuatu.

www.aa.org
With approval of the General Service Board, G.S.O New York launches a site on the World Wide Web on December 22, 1995. With a click, users can now instantaneously access information about the Fellowship in English, Spanish, and French. G.S.O.'s A.A. Website is constantly evolving. In spring 1998, G.S.O. New York shares the experience of computer-savvy A.A.s when it issues a list of Frequently Asked Questions for A.A. entities looking to set up their own website. In 2000, 2006 and 2014 “aa.org” will undergo major expansions.","['First Asia/Oceania Service Meeting\nYears after Bob P. of New Zealand conceives the idea of a zonal meeting serving Asian and Pacific Island A.A. groups, the first Asia/Oceania Service Meeting (AOSM) is held in Tokyo in March 1995.']","[""Planting a seed in China\nIn 1995, retired Chinese physician Dr. Lawrence Luan, who owns a primary health care clinic in Santa Barbara, California, asks the clinic's administrator, who happens to be an A.A. member, to accompany him on a medical business trip to his hometown of Daiwan."", ""Canada's golden anniversary\nDuring the first weekend of July 1995, more than 6,000 A.A.s and friends from Canada, the U.S., South America, Europe, and Asia gather in Toronto at the Metro Convention Center to celebrate 50 years of Alcoholics Anonymous in Canada."", 'Celebrating 60 years\nThe theme of the 60th Anniversary International Convention — “A.A. Everywhere–Anywhere” — is borne out as nearly 56,000 people from the U.S., Canada, and 85 other countries gather in San Diego, California, in June-July 1995.', 'First Asia/Oceania Service Meeting\nYears after Bob P. of New Zealand conceives the idea of a zonal meeting serving Asian and Pacific Island A.A. groups, the first Asia/Oceania Service Meeting (AOSM) is held in Tokyo in March 1995.', 'In spring 1998, G.S.O. New York shares the experience of computer-savvy A.A.s when it issues a list of Frequently Asked Questions for A.A. entities looking to set up their own website.']"
59,1996,"Se publica La Viña
A Spanish-language edition of The Grapevine arrives in the summer of 1996. In the new bimonthly magazine La Viña, articles translated from The Grapevine share space with original material written in Spanish. La Viña is distributed in North America, Latin America, and Spain, and in ensuing years is welcomed by Spanish-speaking A.A.s worldwide.

A Japanese General Service Board
In Tokyo, a General Service Board composed of eight trustees, including two nonalcoholics, starts operating in January 1996. At the time, an estimated 3,500 to 4,000 members are meeting in 290 groups. Japanese A.A. members visit and support Korean groups and vice versa. The handmade card at right, presented by the Kansai district office to a G.S.O. New York staff member visiting Japan, reads “Willingness, honesty, and open-mindedness are the essentials of recovery.”","['In the new bimonthly magazine La Viña, articles translated from The Grapevine share space with original material written in Spanish.']","['Se publica La Viña\nA Spanish-language edition of The Grapevine arrives in the summer of 1996.', 'In the new bimonthly magazine La Viña, articles translated from The Grapevine share space with original material written in Spanish.', 'La Viña is distributed in North America, Latin America, and Spain, and in ensuing years is welcomed by Spanish-speaking A.A.s worldwide.', 'At the time, an estimated 3,500 to 4,000 members are meeting in 290 groups.', 'Japanese A.A. members visit and support Korean groups and vice versa.']"
60,1997,"Support for French Equatorial Africa
A.A. France's sponsorship of African countries begins with a contact between Jean-Yves M. and a Loner from Cameroon, Donatien B., chief warden of a prison and an alcoholic. He achieves sobriety with Jean-Yves's help and determines to carry the message. Jean-Yves and Jean-François L. travel to Cameroon in 1997 and are surprised to find that Donatien has started a prison group that has grown to 54 members. During his stay, Jean-Yves meets with officials, police directors, and members of the clergy. Yearly trips to Africa by A.A. France from 1998 through 2001 will facilitate the launching of groups in Benin, Chad, and Togo. In the photograph, Cameroon villagers greet a visitor from G.S.O. New York with the customary singing and dancing as his traveling companion (foreground), an A.A. from the Douala group, joins in.",['Jean-Yves and Jean-François L. travel to Cameroon in 1997 and are surprised to find that Donatien has started a prison group that has grown to 54 members.'],"[""Support for French Equatorial Africa\nA.A. France's sponsorship of African countries begins with a contact between Jean-Yves M. and a Loner from Cameroon, Donatien B., chief warden of a prison and an alcoholic."", 'Jean-Yves and Jean-François L. travel to Cameroon in 1997 and are surprised to find that Donatien has started a prison group that has grown to 54 members.', 'During his stay, Jean-Yves meets with officials, police directors, and members of the clergy.', 'Yearly trips to Africa by A.A. France from 1998 through 2001 will facilitate the launching of groups in Benin, Chad, and Togo.', 'In the photograph, Cameroon villagers greet a visitor from G.S.O. New York with the customary singing and dancing as his traveling companion (foreground), an A.A. from the Douala group, joins in.']"
61,2000,"Greeting the millennium in Minneapolis
Some 47,000 people celebrate freedom from the bondage of alcoholism at the eleventh International Convention, held in Minneapolis, Minnesota, in the summer of 2000. The theme is “Pass It On–Into the 21st Century.” One memorable event is Walk-the-Walk, in which a stream of attendees from 86 nations walks the blue line laid down from the Convention Center to the Hubert H. Humphrey Metrodome on their way to the opening ceremony. The twenty millionth Big Book is presented to Al-Anon Family Groups in a special ceremony.

Al-Anon's first International Convention
Forty-three years after its founding, Al-Anon holds its first International Convention. The time is July 1998, and the place is Salt Lake City, Utah. As the century draws to an end, 24,000 Al-Anon and 2,300 Alateen groups are meeting in more than 110 countries.

Membership tops two million
As the new millennium begins, A.A.'s worldwide membership is estimated at 2,160,013. Another membership milestone in the year 2000 is the number of groups, which for the first time surpasses the 100,000 mark.

Pole to Pole
Even alcoholics in the most far flung parts of the world — the Arctic Circle and Antarctica — have received the Fellowship's message by the year 2000. With the support of Canadian groups, A.A.s meet in Baffin Island and other far-north locales, while members posted to McMurdo Air Force Base in Antarctica organize meetings for military personnel and others who come and go.

A North American milestone
In April 2000, the 50th General Service Conference is held in New York City. Delegates from 92 A.A. regions and areas in the U.S. and Canada, trustees, directors and G.S.O. and Grapevine staff members listen to reports and inspect finances, just as their counterparts had done half a century before. Conference delegates also tour the new General Service Office in Manhattan's Morningside Heights neighborhood.

Sponsorship Down Under
A.A. Australia, active since 1945, helps A.A.s in Phnom Penh, Cambodia, establish Khmer-speaking groups. The country's service office also assists in the establishment of groups in East Timor, New Guinea, and other Pacific locales. The service office in neighboring New Zealand — which for years has translated A.A. literature into Maori (see Serenity Prayer at right), Fijian, Samoan, and other Pacific island languages — launches an initiative to carry the message to correctional facilities in 32 countries in Oceania and the Pacific Rim.","['The service office in neighboring New Zealand — which for years has translated A.A. literature into Maori (see Serenity Prayer at right), Fijian, Samoan, and other Pacific island languages — launches an initiative to carry the message to correctional facilities in 32 countries in Oceania and the Pacific Rim.']","['As the century draws to an end, 24,000 Al-Anon and 2,300 Alateen groups are meeting in more than 110 countries.', 'Another membership milestone in the year 2000 is the number of groups, which for the first time surpasses the 100,000 mark.', 'With the support of Canadian groups, A.A.s meet in Baffin Island and other far-north locales, while members posted to McMurdo Air Force Base in Antarctica organize meetings for military personnel and others who come and go.', ""The country's service office also assists in the establishment of groups in East Timor, New Guinea, and other Pacific locales."", 'The service office in neighboring New Zealand — which for years has translated A.A. literature into Maori (see Serenity Prayer at right), Fijian, Samoan, and other Pacific island languages — launches an initiative to carry the message to correctional facilities in 32 countries in Oceania and the Pacific Rim.']"
62,2001,"A.A. takes root in China
In August 2001, two G.S.O. New York staff members and Dr. George Vaillant (nonalcoholic trustee) travel to China to meet with medical practitioners and attend meetings of China's three A.A. groups in existence at the time — two in Beijing and one in Changchun. By invitation, Dr. Vaillant addresses a gathering of some 50 physicians on the subject of alcoholism.

First woman chairs General Service Board
In 2001, a woman is elected to chair the General Service Board for the first time: Elaine McDowell, Ph.D. (right), who had served as a Class A (nonalcoholic) trustee for nine years. As chairperson, Dr. McDowell brings more than 28 years of experience in the prevention and treatment fields as well as abiding faith in A.A.'s basic principles.

A.A. at Ground Zero
In the wake of the September 11, 2001, attack on the World Trade Center in New York, exhausted A.A. members among the firefighters, police, and clean-up crews realize the need for A.A. meetings near Ground Zero. At the same time, a Red Cross official reports to G.S.O. New York that many requests for A.A. meetings have been received. The Red Cross then assigns to A.A. a room in a respite center just southwest of the site, its door bearing a circle and triangle. To accommodate everyone, a second room just north is provided. A.A. meetings are organized by Southeast New York Area 49 and New York Intergroup, and the rooms become places where A.A.s can not only meet but also rest, talk, and meditate. Members crafted the iron plaque shown right and presented it to G.S.O. New York and the Intergroup of A.A. as a memento.

The Big Book's Fourth Edition
In November 2001, a new edition of the Big Book — the culmination of four years of development and 25-plus committee meetings — rolls off the presses. While the first 164 pages remain unchanged, the new edition includes the stories of 41 sober alcoholics (24 new stories and 17 “keepers” from the third edition) reaching a wider cross-section of membership by reflecting the breadth of A.A. experiences, ages, beliefs, and ethnicities. G.S.O. New York sends a complimentary copy of the new fourth edition to groups in the U.S. and Canada.","[""A.A. takes root in China\nIn August 2001, two G.S.O. New York staff members and Dr. George Vaillant (nonalcoholic trustee) travel to China to meet with medical practitioners and attend meetings of China's three A.A. groups in existence at the time — two in Beijing and one in Changchun.""]","[""A.A. takes root in China\nIn August 2001, two G.S.O. New York staff members and Dr. George Vaillant (nonalcoholic trustee) travel to China to meet with medical practitioners and attend meetings of China's three A.A. groups in existence at the time — two in Beijing and one in Changchun."", 'A.A. at Ground Zero\nIn the wake of the September 11, 2001, attack on the World Trade Center in New York, exhausted A.A. members among the firefighters, police, and clean-up crews realize the need for A.A. meetings near Ground Zero.', 'At the same time, a Red Cross official reports to G.S.O. New York that many requests for A.A. meetings have been received.', 'A.A. meetings are organized by Southeast New York Area 49 and New York Intergroup, and the rooms become places where A.A.s can not only meet but also rest, talk, and meditate.', 'Members crafted the iron plaque shown right and presented it to G.S.O. New York and the Intergroup of A.A. as a memento.']"
63,2002,"A meeting in Poland
A.A.s from 13 countries travel to Warsaw, Poland in April 2002 for an Eastern European Service Meeting (EESM). Joining delegates from Belarus, Bulgaria, Czech Republic, Estonia, Hungary, Kyrgyzstan, Latvia, Lithuania, Moldova, Poland, Russia, Romania, Slovakia, and Ukraine are guests from Germany and Finland. The meeting is meant to serve as a bridge to World Service Meetings for countries that do not yet participate in them. Since the early 1980s, A.A. Germany had sponsored groups in former East Germany and in Czechoslovakia and Hungary, while Finland provided much support for Russia. In many countries, membership will continue to surge — particularly in Poland and Russia, which in 2004 will have 1,700 and 300 groups respectively. The card to the right is a reproduction of a piece of artwork created by an A.A. member in Warsaw.","['Since the early 1980s, A.A. Germany had sponsored groups in former East Germany and in Czechoslovakia and Hungary, while Finland provided much support for Russia.']","['A meeting in Poland\nA.A.s from 13 countries travel to Warsaw, Poland in April 2002 for an Eastern European Service Meeting (EESM).', 'Joining delegates from Belarus, Bulgaria, Czech Republic, Estonia, Hungary, Kyrgyzstan, Latvia, Lithuania, Moldova, Poland, Russia, Romania, Slovakia, and Ukraine are guests from Germany and Finland.', 'The meeting is meant to serve as a bridge to World Service Meetings for countries that do not yet participate in them.', 'Since the early 1980s, A.A. Germany had sponsored groups in former East Germany and in Czechoslovakia and Hungary, while Finland provided much support for Russia.', 'In many countries, membership will continue to surge — particularly in Poland and Russia, which in 2004 will have 1,700 and 300 groups respectively.']"
