,Year,Content,One line,Five lines
33,1967,"An international award from the Franciscans
In April 1967, Alcoholics Anonymous receives the International Award of the Conventional Franciscan Fathers and Brothers. Dr. John L. Norris, chairman of the Board of Trustees, accepts the plaque and citation, which notes, in part, “The sympathetic understanding and the patient application of charity toward those afflicted with the disease of alcoholism has brought about the rehabilitation of thousands of alcoholics formerly thought to be hopeless alcoholics.”

Bill's writings printed and bound
The A.A. Way of Life, a collection of Bill’s writings, is published in 1967 as a daily source of comfort and inspiration. The title of the book will be changed in 1971 to As Bill Sees It.

Meeting over the airwaves
Ben L., an Internationalist aboard the S.S. Hudson, writes to Box 4-5-9, in 1967 to report on A.A.’s first known ham radio group. “We have about 10 regular members,” he writes, “and it’s just like any other meeting.” The group brings together members around the world every 24 hours. “Some nights, only a few and other nights the whole gang shows up,” he continues. ”More new men show up from time to time, and it is a thrill to hear a new signal breaking in.”

Switzerland: the message in three languages
The year 1967 sees the creation of Switzerland’s first General Service Office, when the Gremium (German for “committee”) begins serving German-speaking A.A.s. The country’s first known group was French-speaking, however, taking shape in 1956 when an alcoholic in Geneva learned of Alcoholics Anonymous at a lecture, obtained A.A. literature, and arranged a meeting with friends. The first known German-speaking group in Switzerland was launched in 1963 in Lucerne. The first known Italian-speaking group will be formed in the canton of Tessin in 1974. In 1979 another G.S.O., serving French and Italian Switzerland, will open in Geneva.","['The country’s first known group was French-speaking, however, taking shape in 1956 when an alcoholic in Geneva learned of Alcoholics Anonymous at a lecture, obtained A.A. literature, and arranged a meeting with friends.']","['Meeting over the airwaves\nBen L., an Internationalist aboard the S.S. Hudson, writes to Box 4-5-9, in 1967 to report on A.A.’s first known ham radio group.', 'Switzerland: the message in three languages\nThe year 1967 sees the creation of Switzerland’s first General Service Office, when the Gremium (German for “committee”) begins serving German-speaking A.A.s.', 'The country’s first known group was French-speaking, however, taking shape in 1956 when an alcoholic in Geneva learned of Alcoholics Anonymous at a lecture, obtained A.A. literature, and arranged a meeting with friends.', 'The first known German-speaking group in Switzerland was launched in 1963 in Lucerne.', 'The first known Italian-speaking group will be formed in the canton of Tessin in 1974.']"
34,1968,"First triennial survey in U.S. and Canada
At the 28th International Congress on Alcohol and Alcoholism, held in late summer 1968 in Washington, D.C., A.A. chairman Dr. John L. Norris reports on the findings of the first survey of members from all states and provinces. Sixty percent of the 11,355 men and women who responded at 466 meetings in 1968 reported that they had gone without a drink for a year or more. The survey, which will be taken every three years, also finds that 41 percent of members said they had not drunk alcohol since their first A.A. meeting.","['The survey, which will be taken every three years, also finds that 41 percent of members said they had not drunk alcohol since their first A.A. meeting.']","['First triennial survey in U.S. and Canada\nAt the 28th International Congress on Alcohol and Alcoholism, held in late summer 1968 in Washington, D.C., A.A. chairman Dr. John L. Norris reports on the findings of the first survey of members from all states and provinces.', 'Sixty percent of the 11,355 men and women who responded at 466 meetings in 1968 reported that they had gone without a drink for a year or more.', 'The survey, which will be taken every three years, also finds that 41 percent of members said they had not drunk alcohol since their first A.A. meeting.']"
35,1969,"The First World Service Meeting
For the first time, representatives from countries where A.A.s have established a G.S.O or a literature distribution center convene to share information on service structures, group services, publishing, and finance. The date is October 8-11, 1969, and the place is New York City. Attendees include Bill W., Chairman Dr. John L. Norris, G.S.O. New York manager Bob H., and delegates from Australia, Belgium, Canada, Colombia, Costa Rica, Finland, France, Germany, Guatemala, Holland, Mexico, New Zealand, Norway, South Africa, United Kingdom, and the U.S.

Hungary’s first open meeting
Midge M., a staff member of G.S.O. New York, travels to Budapest in June 1969 to attend a conference held by the International Institute on Prevention and Treatment of Alcoholism. While there, she arranges Hungary’s first known open A.A. meeting. Members Peter B. of the Netherlands, Inge L. (West Germany), Richard P. (Ireland), and Cecily C. (U.S.) address a group of Hungarian alcoholics as Archer Tongue, director of the Institute, translates. While a small group will be formed in Budapest in 1972, A.A. won’t become firmly established in Hungary until the late 1980s.

Growth of Spanish-speaking groups
As of 1969, 1,500 Spanish-speaking groups are listed at the G.S.O. in New York.","['Attendees include Bill W., Chairman Dr. John L. Norris, G.S.O. New York manager Bob H., and delegates from Australia, Belgium, Canada, Colombia, Costa Rica, Finland, France, Germany, Guatemala, Holland, Mexico, New Zealand, Norway, South Africa, United Kingdom, and the U.S.\n\nHungary’s first open meeting\nMidge M., a staff member of G.S.O. New York, travels to Budapest in June 1969 to attend a conference held by the International Institute on Prevention and Treatment of Alcoholism.']","['Attendees include Bill W., Chairman Dr. John L. Norris, G.S.O. New York manager Bob H., and delegates from Australia, Belgium, Canada, Colombia, Costa Rica, Finland, France, Germany, Guatemala, Holland, Mexico, New Zealand, Norway, South Africa, United Kingdom, and the U.S.\n\nHungary’s first open meeting\nMidge M., a staff member of G.S.O. New York, travels to Budapest in June 1969 to attend a conference held by the International Institute on Prevention and Treatment of Alcoholism.', 'While there, she arranges Hungary’s first known open A.A. meeting.', 'Members Peter B. of the Netherlands, Inge L. (West Germany), Richard P. (Ireland), and Cecily C. (U.S.) address a group of Hungarian alcoholics as Archer Tongue, director of the Institute, translates.', 'While a small group will be formed in Budapest in 1972, A.A. won’t become firmly established in Hungary until the late 1980s.', 'Growth of Spanish-speaking groups\nAs of 1969, 1,500 Spanish-speaking groups are listed at the G.S.O. in New York.']"
36,1970,"Hospital and prison groups worldwide
A G.S.O. New York report of the 1970 World Service Meeting notes that 54,031 “institution members” belong to the Fellowship worldwide: 20,160 members in 742 hospital groups and 33,871 members in 895 prison groups.

Unity in Miami
Miami is the site of the Fellowship’s fifth International Convention in July 1970, the keynote of which is the Declaration of Unity: “This we owe to A.A.’s future: To place our common welfare first; to keep our Fellowship united. For on A.A. unity depend our lives, and the lives of those to come.” Attending are 11,000 people from 50 states and 27 countries — as reported by Box 4-5-9, “the biggest assemblage of alcoholics the world has ever seen — all of them sober!” The convention marks Bill W.’s last public appearance at an A.A. gathering.

A new home for G.S.O. New York
In April 1970, the G.S.O. takes an 11-year lease on new quarters at 468 Park Avenue South in New York City, gaining more space and saving rent money in the process. The office occupies the entire sixth floor.","['Hospital and prison groups worldwide\nA G.S.O. New York report of the 1970 World Service Meeting notes that 54,031 “institution members” belong to the Fellowship worldwide: 20,160 members in 742 hospital groups and 33,871 members in 895 prison groups.']","['Hospital and prison groups worldwide\nA G.S.O. New York report of the 1970 World Service Meeting notes that 54,031 “institution members” belong to the Fellowship worldwide: 20,160 members in 742 hospital groups and 33,871 members in 895 prison groups.', 'Unity in Miami\nMiami is the site of the Fellowship’s fifth International Convention in July 1970, the keynote of which is the Declaration of Unity: “This we owe to A.A.’s future: To place our common welfare first; to keep our Fellowship united.', 'For on A.A. unity depend our lives, and the lives of those to come.”', 'The convention marks Bill W.’s last public appearance at an A.A. gathering.', 'A new home for G.S.O. New York\nIn April 1970, the G.S.O. takes an 11-year lease on new quarters at 468 Park Avenue South in New York City, gaining more space and saving rent money in the process.']"
37,1971,"Loners gather in Malaysia
In February 1971, Enos C., an A.A. Loner working in Kuala Lumpur, places a notice in the Malay Mail newspaper seeking other Loners interested in holding meetings. Six weeks later, Enos reports to G.S.O. New York that with the addition of two Canadian A.A.s in Kuala Lumpur, the fledgling Pertama Group already numbers five. By the end of the decade, four more groups will have started in Sarawak and other Malaysian cities.

The death of Bill W.
At the age of 75, Bill W. dies on January 24, 1971 at the Miami Heart Institute in Miami Beach, Florida. On February 14, groups around the world hold memorial meetings honoring Bill’s work as co-founder of Alcoholics Anonymous, author of the Big Book and other publications, and architect and articulator of the Fellowship’s principles.","['On February 14, groups around the world hold memorial meetings honoring Bill’s work as co-founder of Alcoholics Anonymous, author of the Big Book and other publications, and architect and articulator of the Fellowship’s principles.']","['Loners gather in Malaysia\nIn February 1971, Enos C., an A.A. Loner working in Kuala Lumpur, places a notice in the Malay Mail newspaper seeking other Loners interested in holding meetings.', 'Six weeks later, Enos reports to G.S.O. New York that with the addition of two Canadian A.A.s in Kuala Lumpur, the fledgling Pertama Group already numbers five.', 'By the end of the decade, four more groups will have started in Sarawak and other Malaysian cities.', 'The death of Bill W.', 'On February 14, groups around the world hold memorial meetings honoring Bill’s work as co-founder of Alcoholics Anonymous, author of the Big Book and other publications, and architect and articulator of the Fellowship’s principles.']"
38,1972,"Italy comes aboard
The start-up of A.A. in Italy is said to be 1972, when a small group of Americans meeting in Rome is joined by locals Giovanni and Ermanno. Assisted by some of the Americans, the two men soon join with Carol C. to form the first known Italian-speaking A.A. group. Two years later, a group will be founded in Florence, and Milan will follow suit in 1976. In 1978, representatives of several groups meet to start negotiations with G.S.O. New York for the sponsorship of the publication of Il Grande Libro (the Big Book), which is already being translated into Italian. They succeed, and Alcolisti Anonimi (droit) is published in 1980.","['Assisted by some of the Americans, the two men soon join with Carol C. to form the first known Italian-speaking A.A. group.']","['Italy comes aboard\nThe start-up of A.A. in Italy is said to be 1972, when a small group of Americans meeting in Rome is joined by locals Giovanni and Ermanno.', 'Assisted by some of the Americans, the two men soon join with Carol C. to form the first known Italian-speaking A.A. group.', 'Two years later, a group will be founded in Florence, and Milan will follow suit in 1976.', 'In 1978, representatives of several groups meet to start negotiations with G.S.O. New York for the sponsorship of the publication of Il Grande Libro (the Big Book), which is already being translated into Italian.']"
39,1973,"Big Book distribution reaches one million
The one millionth copy of Alcoholics Anonymous, A.A.'s Big Book, is presented to President Richard Nixon in a ceremony at the White House.

Bangkok’s first known meetings
In Bangkok in 1971, two Americans of Irish descent — Jim L., a businessman with three years of sobriety, and Evelyn K., wife of a civil engineer under contract in Bangkok — team up to form an A.A. group. The next year they are joined by Jack B., a Redemptorist priest. In 1973, the three move their meetings from Evelyn’s apartment to the Holy Redeemer Rectory and welcome new member Joanne — the wife of an American Embassy official — and George, a German-born U.S. military member. The stabilization of the Bangkok group soon gives rise to the founding of A.A. groups in Ubon and other Thai cities.

Lois’s round-the-world trip
In an echo of their 1950 visit to Europe, Lois W. sets out on a nine-week trip around the world a year after Bill’s death. Her traveling companion is Evelyn C., an early volunteer at the Al-Anon Clearing House and later a staff member at the Al-Anon World Service Office. During their journey the women meet with members of A.A. and Al-Anon in South Africa, Australia, New Zealand, Hong Kong, Tokyo, and Honolulu. (Shown to the right is a gift later presented to Lois, the Serenity Prayer in Japanese.) In Lois Remembers, Lois will write that “Seeing and feeling the loving devotion and oneness of A.A. and Al-Anon around the world did much to submerge in an overwhelming sea of gratitude my sense of personal loss.""

Musings from members
Came to Believe, a 120-page booklet published in 1973 by A.A., is a collection of stories by members who tell in their own words what significance the phrase “spiritual awakening” holds for them. One story describes, “I began to see another part of me emerging — a grateful me, expecting nothing, but sure that another power was beginning to guide me, counsel me, and direct my ways.”

Intergroups in Wales
The first known group in Wales was founded in Abergavenny in 1963. Until then most alcoholics who wanted to attend A.A. meetings had to cross the border into England. A decade later, the Welsh Borders Intergroup is founded to link groups on both sides of the border (shown at right are the towns where the groups meet). An intergroup has also been established in South Wales—the Cymraig Intergroup, composed of groups in Cardiff, Swansea, Llanelli, and Newport.","['Bangkok’s first known meetings\nIn Bangkok in 1971, two Americans of Irish descent — Jim L., a businessman with three years of sobriety, and Evelyn K., wife of a civil engineer under contract in Bangkok — team up to form an A.A. group.']","['Bangkok’s first known meetings\nIn Bangkok in 1971, two Americans of Irish descent — Jim L., a businessman with three years of sobriety, and Evelyn K., wife of a civil engineer under contract in Bangkok — team up to form an A.A. group.', 'The stabilization of the Bangkok group soon gives rise to the founding of A.A. groups in Ubon and other Thai cities.', 'Her traveling companion is Evelyn C., an early volunteer at the Al-Anon Clearing House and later a staff member at the Al-Anon World Service Office.', 'During their journey the women meet with members of A.A. and Al-Anon in South Africa, Australia, New Zealand, Hong Kong, Tokyo, and Honolulu.', 'In Lois Remembers, Lois will write that “Seeing and feeling the loving devotion and oneness of A.A. and Al-Anon around the world did much to submerge in an overwhelming sea of gratitude my sense of personal loss.""']"
40,1974,"Poland’s first steps
A group of alcoholics who have been meeting with physicians and therapists since the mid-1960s in the city of Poznan decide in 1974 to meet on their own and follow the principles of A.A. (Earlier meetings had been organized by therapist Maria Grabowska, who had tried to have the Twelve Traditions and Twelve Steps published in Polish newspapers but was thwarted by the censorship office.) Led by Rajmund F., a Pole who became sober in 1973 and was fluent enough in English and German to translate A.A. literature, the group takes the name Eleusis, after the ancient Greek city the Roman Emperors favored as sanctuary. Growth accelerates, and by June 1985 almost 100 groups will be meeting across the country. The decorative plate shown above was presented to G.S.O. New York by grateful Polish members.

A vote in Uruguay
Pablo L., an actor, undergoes detoxification at Montevideo’s Clinica del Prado in 1966, is given a copy of the Big Book, and in turn seeks out an A.A. group to join. The closest is in Buenos Aires, where he frequents A.A. meetings during an extended stay. Returning home, he visits hospitals to carry the message. He then founds ADEA (for Amigos del Enfermo Alcohólico, or friends of the alcoholic patient), where alcoholics and their families share experiences. While some aspects of the A.A. program are used, others—including anonymity—are rejected. After A.A. Argentina urges ADEA to follow all A.A. Traditions and to take the Fellowship’s name, the issue is put to a vote. The ayes have it, and on March 18, 1974, the first known Uruguayan meeting of A.A. is held in Montevideo.","['Poland’s first steps\nA group of alcoholics who have been meeting with physicians and therapists since the mid-1960s in the city of Poznan decide in 1974 to meet on their own and follow the principles of A.A. (Earlier meetings had been organized by therapist Maria Grabowska, who had tried to have the Twelve Traditions and Twelve Steps published in Polish newspapers but was thwarted by the censorship office.)']","['Poland’s first steps\nA group of alcoholics who have been meeting with physicians and therapists since the mid-1960s in the city of Poznan decide in 1974 to meet on their own and follow the principles of A.A. (Earlier meetings had been organized by therapist Maria Grabowska, who had tried to have the Twelve Traditions and Twelve Steps published in Polish newspapers but was thwarted by the censorship office.)', 'Led by Rajmund F., a Pole who became sober in 1973 and was fluent enough in English and German to translate A.A. literature, the group takes the name Eleusis, after the ancient Greek city the Roman Emperors favored as sanctuary.', 'A vote in Uruguay\nPablo L., an actor, undergoes detoxification at Montevideo’s Clinica del Prado in 1966, is given a copy of the Big Book, and in turn seeks out an A.A. group to join.', 'After A.A. Argentina urges ADEA to follow all A.A. Traditions and to take the Fellowship’s name, the issue is put to a vote.', 'The ayes have it, and on March 18, 1974, the first known Uruguayan meeting of A.A. is held in Montevideo.']"
41,1975,"Delegates descend on Denver
“Let It Begin With Me” is the theme of the Fellowship’s 40th Anniversary International Convention, held in Denver, Colorado in 1975. Some 19,500 attendees stream into the city, and Host Committee members register arrivals at the rate of 400 per hour. At the formal opening session, a replica of the Big Book dominates the dais and gives new meaning to the word “big.” It is 28 feet tall. Living Sober is published
In 1975, A.A. published Living Sober, a book of member experiences that describes methods of living without drinking. The material for the book was gathered in the early 1970s from group and individual correspondence of shared experience, then writers compiled it into a book. The book becomes a popular addition to A.A. literature.

A new beginning in Portugal
English-speaking groups in Portugal had met as early as 1956 in Lisbon and 1959 at Lajes Air Force Base in the nearby Azores. Yet A.A. doesn’t take root in the country until 1975, when American Ed A. returns from rehabilitation in the United States and begins spreading the A.A. message in hospitals. As a result, Portuguese-speaking groups are founded in Lisbon, Oporto, and Algarve. Aiding the growth and stability of the groups is Portuguese-language A.A. literature sent by A.A. Brazil.

A.A. Archives open at General Service Office
In November 1975, Lois W. and Tom S. of Jacksonville, Florida (a trustee who chairs the archives committee), cut a blue ribbon to officially open the A.A. Archives at G.S.O. New York. In a brief speech, Dr. John L. Norris points out that A.A. must continually renew itself by going back to its source, recalling Bill W.’s frequent request that the Board and G.S.O. “should put everything they do on the record.” The archivist is nonalcoholic Nell Wing (right), who served as Bill’s secretary for many years and is described as a “one-woman walking encyclopedia of A.A. lore.”

A.A. in Jerusalem
With the aid of Canadian A.A. members who are part of the UN forces in the Middle East, the Shalom Group is formed in Jerusalem in 1975. The next year, member Jay S. reports to G.S.O. New York that twice-weekly A.A. meetings are being held in Tel Aviv as well as Jerusalem, in both English and Hebrew. The Shalom Group will also host a two-day convention to celebrate the first anniversary of A.A. in Israel. Shown above right are A.A. pamphlets in Hebrew and Arabic.","['The next year, member Jay S. reports to G.S.O. New York that twice-weekly A.A. meetings are being held in Tel Aviv as well as Jerusalem, in both English and Hebrew.']","['Living Sober is published\nIn 1975, A.A. published Living Sober, a book of member experiences that describes methods of living without drinking.', 'A.A. Archives open at General Service Office\nIn November 1975, Lois W. and Tom S. of Jacksonville, Florida (a trustee who chairs the archives committee), cut a blue ribbon to officially open the A.A. Archives at G.S.O. New York.', 'A.A. in Jerusalem\nWith the aid of Canadian A.A. members who are part of the UN forces in the Middle East, the Shalom Group is formed in Jerusalem in 1975.', 'The next year, member Jay S. reports to G.S.O. New York that twice-weekly A.A. meetings are being held in Tel Aviv as well as Jerusalem, in both English and Hebrew.', 'The Shalom Group will also host a two-day convention to celebrate the first anniversary of A.A. in Israel.']"
42,1976,"Fast-forward in Iceland
Though the Reykjavik Group had been meeting in Iceland since 1954, a breakthrough occurs in the early 1970s, when a government-sponsored program begins flying alcoholics to the U.S. for help on a regular basis. Almost invariably they return eager to carry the A.A. message, leading to the 1976 publication of the Big Book in Icelandic. The subsequent explosive growth in membership results in a change in public opinion regarding alcoholism and the establishment of new treatment centers.

JUNAAB created in Brazil
While records show A.A. meetings were held in Brazil as early as 1947, the country’s first General Service Board — Junta Nacional de Alcoólicos Anônimos, or JUNAAB, is created in February 1976.

Third edition of Big Book published in 1976
Thirteen new stories appear in the Third Edition of Alcoholics Anonymous. By the summer of 1976, more than 1,450,000 copies of the Big Book’s first two editions had been distributed worldwide, and both a Braille edition and audio tapes have been released.

Membership tops a million
At the opening of the 26th annual meeting of the General Service Conference, held in New York in April 1976, new figures for the Fellowship’s worldwide reach are reported: an estimated 28,000 groups in 92 countries, with membership totaling more than 1,000,000.","['Membership tops a million\nAt the opening of the 26th annual meeting of the General Service Conference, held in New York in April 1976, new figures for the Fellowship’s worldwide reach are reported: an estimated 28,000 groups in 92 countries, with membership totaling more than 1,000,000.']","['Almost invariably they return eager to carry the A.A. message, leading to the 1976 publication of the Big Book in Icelandic.', 'JUNAAB created in Brazil\nWhile records show A.A. meetings were held in Brazil as early as 1947, the country’s first General Service Board — Junta Nacional de Alcoólicos Anônimos, or JUNAAB, is created in February 1976.', 'Third edition of Big Book published in 1976\nThirteen new stories appear in the Third Edition of Alcoholics Anonymous.', 'By the summer of 1976, more than 1,450,000 copies of the Big Book’s first two editions had been distributed worldwide, and both a Braille edition and audio tapes have been released.', 'Membership tops a million\nAt the opening of the 26th annual meeting of the General Service Conference, held in New York in April 1976, new figures for the Fellowship’s worldwide reach are reported: an estimated 28,000 groups in 92 countries, with membership totaling more than 1,000,000.']"
