,Year,Content,One line,Five lines
15,1949,"The Scottish messenger
In 1948, Sir Philip D., a Scottish gentleman farmer who has long struggled with alcoholism, travels to the U.S. at the invitation of the Oxford Group. There he meets A.A. member George R., who acquaints him with the Fellowship’s principles. Sir Philip returns home determined to stop drinking and to carry the A.A. message. He succeeds, and Scotland’s first known groups are founded in May 1949 in Edinburgh and in Glasgow, where meetings are held in the St. Enoch Hotel (right).

Bill W. addresses the American Psychiatric Association
At the invitation of Dr. Kirby Collier of Rochester, New York, one of A.A.’s earliest admirers in the psychiatric profession, Bill W. participates in an alcoholism symposium at the American Psychiatric Association Annual Meeting in Montreal, May 1949. His address marks the acceptance of A.A. by yet another major American medical organization. Bill's address is titled ""The Society of Alcoholics Anonymous.""

Rapid growth in Holland
In January 1949, Henk Krauweel, of the Medical Bureau for Alcohol in Amsterdam, reports to the Alcoholic Foundation that he and two of his patients, John V. and Carel A., intend to organize an A.A. meeting in mid-February. They do so, and with much success. In the next two years, a number of groups will be started in Rotterdam, Haarlem, The Hague, and other Dutch cities.","['Bill W. addresses the American Psychiatric Association\nAt the invitation of Dr. Kirby Collier of Rochester, New York, one of A.A.’s earliest admirers in the psychiatric profession, Bill W. participates in an alcoholism symposium at the American Psychiatric Association Annual Meeting in Montreal, May 1949.']","['The Scottish messenger\nIn 1948, Sir Philip D., a Scottish gentleman farmer who has long struggled with alcoholism, travels to the U.S. at the invitation of the Oxford Group.', 'Sir Philip returns home determined to stop drinking and to carry the A.A. message.', 'Bill W. addresses the American Psychiatric Association\nAt the invitation of Dr. Kirby Collier of Rochester, New York, one of A.A.’s earliest admirers in the psychiatric profession, Bill W. participates in an alcoholism symposium at the American Psychiatric Association Annual Meeting in Montreal, May 1949.', 'His address marks the acceptance of A.A. by yet another major American medical organization.', 'Rapid growth in Holland\nIn January 1949, Henk Krauweel, of the Medical Bureau for Alcohol in Amsterdam, reports to the Alcoholic Foundation that he and two of his patients, John V. and Carel A., intend to organize an A.A. meeting in mid-February.']"
16,1950,"A.A.’s first International Convention
In July 1950, Alcoholics Anonymous’ 15th anniversary is marked with an international convention in Cleveland, with some 3,000 people in attendance. One of the most significant events is the adoption of the Twelve Traditions. The convention, held at the Cleveland Public Auditorium (right), also features the last public message to the Fellowship by Dr. Bob, who stresses, in his brief remarks, kindness and “keeping it simple.”

Denmark: From Ring i Ring to A.A.
In 1948 a group belonging to a national temperance society called Ring i Ring is founded by Dr. Martensen, a doctor who treats alcoholic patients. It meets in a restaurant (right) at Copenhagen’s zoo. In the summer of 1949, A.A. member Gordon McD. and his wife visits Ring i Ring at a meeting place in Lyngby, a small suburban outside Copenhagen. The group changes its name to “Ring i Ring Danish A.A.” in January 1950 and lists with the Alcoholic Foundation. In the next few years, other Ring i Ring members will break away and hold closed meetings based on the Twelve Steps and other A.A. principles.

Peru’s inaugural group
After reading in Look magazine about ACE, a treatment for acute alcoholism, Percy N., an American living in Lima, writes to the Alcoholic Foundation asking for its view of the treatment. The Foundation responds by sending him three Alcoholics Anonymous pamphlets. In turn, Percy expresses his wish to become a member and start a group, which he proceeds to do in November 1950.

The death of Dr. Bob
Dr. Bob dies of cancer on November 16, 1950. During the Akron physician’s 15 years of sobriety, the Fellowship he started with Bill W. had transformed the lives of close to 100,000 men and women and their loved ones.","['In the next few years, other Ring i Ring members will break away and hold closed meetings based on the Twelve Steps and other A.A. principles.']","['The convention, held at the Cleveland Public Auditorium (right), also features the last public message to the Fellowship by Dr. Bob, who stresses, in his brief remarks, kindness and “keeping it simple.”', 'In 1948 a group belonging to a national temperance society called Ring i Ring is founded by Dr. Martensen, a doctor who treats alcoholic patients.', 'The group changes its name to “Ring i Ring Danish A.A.” in January 1950 and lists with the Alcoholic Foundation.', 'In the next few years, other Ring i Ring members will break away and hold closed meetings based on the Twelve Steps and other A.A. principles.', 'In turn, Percy expresses his wish to become a member and start a group, which he proceeds to do in November 1950.']"
17,1951,"A.A.’s first General Service Conference
The first General Service Conference, orchestrated by chairman of the Alcoholic Foundation Bernard Smith, is held in April 1951 at the Commodore Hotel in New York. Bill W. later writes of its significance to A.A.: “The delegates . . . listened to reports from the Board of Trustees and from all of the services. There was warm but cordial debate on many questions of A.A. policy... [It was proved] as never before that A.A.’s Tradition Two was correct: Our group conscience could safely act as the sole authority and sure guide for Alcoholics Anonymous.”

A prestigious award
In San Francisco in October 1951, the American Public Health Association presents Alcoholics Anonymous with the Lasker Award, “in recognition of its unique and highly successful approach” to an “age-old public health and social problem.” The award is made possible through benefactions of Mary and Albert Lasker, New York philanthropists. A ceremony with Bill W. and Board of Trustees chairman Bernard Smith as speakers is attended by some 3,000 A.A.s and family members, physicians, public health experts, and clergymen. In the newspaper photograph to the right, Smith is shown at far left.","['A ceremony with Bill W. and Board of Trustees chairman Bernard Smith as speakers is attended by some 3,000 A.A.s and family members, physicians, public health experts, and clergymen.']","['A.A.’s first General Service Conference\nThe first General Service Conference, orchestrated by chairman of the Alcoholic Foundation Bernard Smith, is held in April 1951 at the Commodore Hotel in New York.', 'Bill W. later writes of its significance to A.A.: “The delegates . . . listened to reports from the Board of Trustees and from all of the services.', 'A prestigious award\nIn San Francisco in October 1951, the American Public Health Association presents Alcoholics Anonymous with the Lasker Award, “in recognition of its unique and highly successful approach” to an “age-old public health and social problem.”', 'The award is made possible through benefactions of Mary and Albert Lasker, New York philanthropists.', 'A ceremony with Bill W. and Board of Trustees chairman Bernard Smith as speakers is attended by some 3,000 A.A.s and family members, physicians, public health experts, and clergymen.']"
18,1952,"The arrival of Al-Anon
In loosely organized Family Groups, loved ones of A.A. members had gathered together and shared their experiences since the Fellowship’s earliest days. At Bill W.’s urging, his wife Lois moves to create a separate fellowship that will formalize these meetings. With Anne B., who had initiated a Family Group in Westchester County, New York, Lois sends a letter to 87 such groups suggesting that they unite under the name of Al-Anon. The response is positive, and Al-Anon Family Groups is born. In January 1952 Lois and Anne shift the growing organization’s office from Stepping Stones to the 24th Street Clubhouse in Manhattan.

Caribbean by way of Canada
Though there had inquiries from the Bahamas as early as 1944, Burton L., an A.A. member from Toronto now living in Nassau, forms the first stable group in the Bahamas in 1952 — four members who meet on Sunday afternoons. The group, one of the first in the Caribbean, makes a contribution of $6 when it registers with the Alcoholic Foundation.

","['The arrival of Al-Anon\nIn loosely organized Family Groups, loved ones of A.A. members had gathered together and shared their experiences since the Fellowship’s earliest days.']","['The arrival of Al-Anon\nIn loosely organized Family Groups, loved ones of A.A. members had gathered together and shared their experiences since the Fellowship’s earliest days.', 'With Anne B., who had initiated a Family Group in Westchester County, New York, Lois sends a letter to 87 such groups suggesting that they unite under the name of Al-Anon.', 'The response is positive, and Al-Anon Family Groups is born.', 'Caribbean by way of Canada\nThough there had inquiries from the Bahamas as early as 1944, Burton L., an A.A. member from Toronto now living in Nassau, forms the first stable group in the Bahamas in 1952 — four members who meet on Sunday afternoons.', 'The group, one of the first in the Caribbean, makes a contribution of $6 when it registers with the Alcoholic Foundation.']"
19,1953,"A post-war beginning in Germany
A handful of U.S. servicemen, all recovering alcoholics stationed at U.S. Army Base I Munich after the end of World War II, take on the responsibility of forming the first known A.A. group in Germany. On a mission to sober up local alcoholics, they post notices of a meeting to be held at Hotel Leopold (right) on November 1, 1953. Among the 25 attendees are Max, Kurt, and Heindrich, who will meet with the Americans in what will come to be called Germany’s “mother group.”

Twelve Steps and Twelve Traditions is first published — 1953
Bill W. becomes increasingly devoted to writing projects, one of which emerges as Twelve Steps and Twelve Traditions — the book that sets forth his deepest understanding of A.A.’s basic principles.

Nicaragua’s inaugural group
In the fall of 1953, Grupo de A.A. La Merced is founded in León by Jack M., who took up residence in Nicaragua in 1950, and then joined A.A. while on a brief visit to the United States Groups in the capital city of Managua and other Nicaraguan population centers will start meeting a decade later, facilitated by the Alcoholic Foundation.

The Big Book hits Belgium
At a gathering of English-speaking and Belgian alcoholics in Brussels, Jean L. introduces the Big Book and the principles of Alcoholics Anonymous. Within months of the October 1953 meeting, groups start assembling not only in Belgium’s capital but also in cities and towns in Flanders and Wallonia.","['A post-war beginning in Germany\nA handful of U.S. servicemen, all recovering alcoholics stationed at U.S. Army Base I Munich after the end of World War II, take on the responsibility of forming the first known A.A. group in Germany.']","['A post-war beginning in Germany\nA handful of U.S. servicemen, all recovering alcoholics stationed at U.S. Army Base I Munich after the end of World War II, take on the responsibility of forming the first known A.A. group in Germany.', 'Twelve Steps and Twelve Traditions is first published — 1953\nBill W. becomes increasingly devoted to writing projects, one of which emerges as Twelve Steps and Twelve Traditions — the book that sets forth his deepest understanding of A.A.’s basic principles.', 'Nicaragua’s inaugural group\nIn the fall of 1953, Grupo de A.A. La Merced is founded in León by Jack M., who took up residence in Nicaragua in 1950, and then joined A.A. while on a brief visit to the United States Groups in the capital city of Managua and other Nicaraguan population centers will start meeting a decade later, facilitated by the Alcoholic Foundation.', 'The Big Book hits Belgium\nAt a gathering of English-speaking and Belgian alcoholics in Brussels, Jean L. introduces the Big Book and the principles of Alcoholics Anonymous.', 'Within months of the October 1953 meeting, groups start assembling not only in Belgium’s capital but also in cities and towns in Flanders and Wallonia.']"
20,1954,"Bill W. declines honorary degrees
In the wake of Alcoholic Anonymous’ success, several colleges and universities offer Bill W. honorary degrees. He declines, explaining why in this excerpt from a letter to Yale University, which had proposed an honorary Doctor of Laws degree: “The tradition of Alcoholics Anonymous . . . entreats each member to avoid all that particular kind of personal publicity or distinction which might link his name with our Society in the general public mind.” He then quotes A.A.’s need for anonymity, as stated in Tradition Twelve.

The Alcoholic Foundation becomes the General Service Board
Changing the name of the Alcoholic Foundation to the General Service Board of Alcoholics Anonymous was first proposed at the first General Service Conference in the spring of 1951, but the switch becomes official in 1954. The motivation is to signal that the A.A. membership is taking full responsibility for itself.

Membership exceeds 100,000
By the end of A.A.’s second decade, some 130,000 members are meeting in approximately 6,000 groups on five continents.","['He declines, explaining why in this excerpt from a letter to Yale University, which had proposed an honorary Doctor of Laws degree: “The tradition of Alcoholics Anonymous . . . entreats each member to avoid all that particular kind of personal publicity or distinction which might link his name with our Society in the general public mind.”']","['Bill W. declines honorary degrees\nIn the wake of Alcoholic Anonymous’ success, several colleges and universities offer Bill W. honorary degrees.', 'He declines, explaining why in this excerpt from a letter to Yale University, which had proposed an honorary Doctor of Laws degree: “The tradition of Alcoholics Anonymous . . . entreats each member to avoid all that particular kind of personal publicity or distinction which might link his name with our Society in the general public mind.”', 'He then quotes A.A.’s need for anonymity, as stated in Tradition Twelve.', 'The Alcoholic Foundation becomes the General Service Board\nChanging the name of the Alcoholic Foundation to the General Service Board of Alcoholics Anonymous was first proposed at the first General Service Conference in the spring of 1951, but the switch becomes official in 1954.', 'Membership exceeds 100,000\nBy the end of A.A.’s second decade, some 130,000 members are meeting in approximately 6,000 groups on five continents.']"
21,1955,"Joining the fold...
The St. Louis Convention of 1955 affirms the Fellowship’s maturity as Bill W. passes to the members the responsibility for A.A.’s Three Legacies of Recovery, Unity, and Service. The Convention signals a decade of change—one that sees the consolidation of family groups under the name of Al-Anon, a separate fellowship that, like Alcoholics Anonymous, has spread to almost every corner of the world.

A.A. in Argentina
In the early 1950s, Hector G. of Buenos Aires is rescued from alcoholism after reading Alcoholics Anonymous and seeking the aid of a physician. He writes to the Alcoholic Foundation, which sends him A.A. literature in Spanish and asks permission to list him as a contact for referrals. Hector founds Argentina’s first known group, and in 1955 will report that its members are relishing their newfound sobriety.

A bulletin for Loners
Hundreds of Loners — individuals who are listed with A.A. but do not belong to a group — are being mailed G.S.O.’s monthly bulletin, ""Twelfth Stepper,"" each issue of which features personal stories of Loners from around the world. The stated purpose is to enable such members “to share A.A. love and gratitude, strength and faith with one another.” A previous bulletin — ""The Internationalists Round Robin,"" launched in 1949 — had grown out of the efforts of Captain Jack S., a sailor who found sobriety in A.A. and maintained it by exchanging letters with groups he helped start around the world.

Mr. Eddie of El Salvador
Edward F., who has carried the Fellowship’s message to several alcoholics in Boston and San Francisco, moves to San Salvador with his Salvadoran wife. After initially finding it hard to arouse interest in A.A., a friend of his wife introduces Edward to her alcoholic uncle, Don A., and the two men form a group that meets at the home of Atilio, a wealthy alcoholic. As membership grows, meetings are moved to the Garcia Flamenco school building. “Mr. Eddie,” as he becomes known, will later help start groups in other Central American countries.

First meetings in Madrid
A Mrs. Garcia of New York informs G.S.O. New York of the wish of Dr. E. Pelaz, a psychiatrist at a Madrid sanitarium, to launch an A.A. group. The G.S.O. sends Pelaz pamphlets and the name of its Madrid contact, American Ray C. Ray and fellow alcoholic Dan C. begin holding English-language meetings in June 1955. By the end of the year membership has increased fourfold and a Spanish-American group is meeting at Pelaz’s sanitarium. Before long, the Spaniards form a separate group, which quickly attracts more members and spurs the formation of A.A. groups countrywide.

A historic International Convention
In July 1955, some 5,000 people attend the second International Convention in St. Louis (right). President Dwight D. Eisenhower recognizes the occasion with a congratulatory telegram. Among the important events at this 20th anniversary gathering is Bill’s presentation on A.A. history and the importance of understanding it. In addition, the second edition of the Big Book is launched. The Al-Anon Fellowship, now four years old, participates in five workshops.

Second Edition of Big Book published in 1955
The second edition of Alcoholics Anonymous reflects the membership’s growing diversity. The chapters on A.A. principles remain the same, and eight of the stories of early members’ efforts to achieve sobriety are retained in a section called “Pioneers of A.A.” In addition, 24 new stories appear in two separate sections: “They Stopped in Time” and “They Lost Nearly All.” The Twelve Traditions are added as well.

Bill W. passes the torch, July 1955
The St. Louis Convention culminates with Bill officially handing leadership of A.A. over to the members. The resolution he reads is passed with a roar of approval: “Be it therefore resolved that the General Service Conference... should become as of this date... the guardian of the Traditions of Alcoholics Anonymous, the perpetuators of the world services of our Society, the voice of the group conscience of our entire Fellowship, and the sole successors of its co-founders, Doctor Bob and Bill.”

The Third Legacy
At the St. Louis Convention, Bill speaks of the Fellowship’s Third Legacy, that of Service. In his words “. . . an A.A. service is anything whatever that helps us to reach a fellow sufferer. . .from the Twelfth Step itself to a ten-cent phone call and a cup of coffee, and to A.A.’s General Service Office for national and international action.” Fifty thousand Third Legacy booklets (right), known today as The A.A. Service Manual, will be printed and distributed to A.A. groups.","['Joining the fold...\nThe St. Louis Convention of 1955 affirms the Fellowship’s maturity as Bill W. passes to the members the responsibility for A.A.’s Three Legacies of Recovery, Unity, and Service.']","['Joining the fold...\nThe St. Louis Convention of 1955 affirms the Fellowship’s maturity as Bill W. passes to the members the responsibility for A.A.’s Three Legacies of Recovery, Unity, and Service.', 'A bulletin for Loners\nHundreds of Loners — individuals who are listed with A.A. but do not belong to a group — are being mailed G.S.O.’s monthly bulletin, ""Twelfth Stepper,"" each issue of which features personal stories of Loners from around the world.', 'First meetings in Madrid\nA Mrs. Garcia of New York informs G.S.O. New York of the wish of Dr. E. Pelaz, a psychiatrist at a Madrid sanitarium, to launch an A.A. group.', 'Bill W. passes the torch, July 1955\nThe St. Louis Convention culminates with Bill officially handing leadership of A.A. over to the members.', 'The resolution he reads is passed with a roar of approval: “Be it therefore resolved that the General Service Conference... should become as of this date... the guardian of the Traditions of Alcoholics Anonymous, the perpetuators of the world services of our Society, the voice of the group conscience of our entire Fellowship, and the sole successors of its co-founders, Doctor Bob and Bill.”']"
22,1956,"Venezuela joins the fold
A few Americans who gather for A.A. meetings in Caracas place a small ad in a local English-language newspaper. It draws the attention of Christiaan V., who previously attempted to start a Spanish-speaking group. With the help of the Americans, Christiaan carries the message to Luis and Clyde, and the three men become the first link in a chain of groups that will spread across Venezuela.

A.A.’s first overseas General Service Board
The quick growth of Alcoholics Anonymous in Great Britain and Ireland makes apparent the need for a separate General Service Board. After seeking guidance from G.S.O. New York, representatives from England, Wales, Scotland and Ireland meet in London on October 28, 1956. They resolve to establish a Board of Trustees based on the U.S. model, to be known as the General Service Board of Alcoholics Anonymous in Great Britain & Ireland, Ltd. The first G.S.B. outside the U.S., housed in London’s Fruit Exchange (right), will begin operations in 1957.",['A.A.’s first overseas General Service Board\nThe quick growth of Alcoholics Anonymous in Great Britain and Ireland makes apparent the need for a separate General Service Board.'],"['With the help of the Americans, Christiaan carries the message to Luis and Clyde, and the three men become the first link in a chain of groups that will spread across Venezuela.', 'A.A.’s first overseas General Service Board\nThe quick growth of Alcoholics Anonymous in Great Britain and Ireland makes apparent the need for a separate General Service Board.', 'After seeking guidance from G.S.O. New York, representatives from England, Wales, Scotland and Ireland meet in London on October 28, 1956.', 'They resolve to establish a Board of Trustees based on the U.S. model, to be known as the General Service Board of Alcoholics Anonymous in Great Britain & Ireland, Ltd.', 'The first G.S.B. outside the U.S., housed in London’s Fruit Exchange (right), will begin operations in 1957.']"
